backlog_id,topic,status_after_v3,result_source_ids,decision,next_action
B001,"Avinox MG Concept final official datasheet / mechanism closure","partially_resolved_quasi_production_booth_evidence","V017;V029;V032","Tech Details booth images provide high-confidence Avinox production-direction and quasi-production product-definition targets and should be used for internal benchmarking; final public datasheet, mechanism, test basis and production release remain open as closure items.","Use browser/visual search on Avinox press kits, Eurobike galleries, Avinox social posts, OEM prototype pages and patent search."
B002,"BikeBiz Gobao X1/X1P report","not_resolved","V017","The Verge attribution remains secondary. Direct BikeBiz original not located.","Search BikeBiz archive manually and search exact date/title variants."
B003,"Valeo Cyclee / Smart e-Bike System official material","partially_resolved_media_only","V015","Upgrade from no-evidence backlog to historical media lead. Still not official/current.","Find official Valeo archive/current Cyclee page and OEM bike evidence."
B004,"Revonte ONE official/archive material","partially_resolved_lead_only","V016","Search located media lead, but article content not extracted and no official status verified.","Use web archive/company registry and official patent/material search."
B005,"Owuru architecture and official product pages","partially_resolved_official_chain_found","V033;V034;V035;V036;V037;V039","Official E2Drives, OWURU and Decathlon pages now verify the city-bike technology chain and Decathlon LD 920 E OEM fit; E-MOUNTAINBIKE and DOWNTOWN add high-power route and UX media evidence. Remaining gap is no official high-power eMTB/cargo datasheet, efficiency map, heat/lifespan/service evidence or non-Decathlon OEM production proof.","Track official high-power Owuru/E2Drives materials, patents, service documents, efficiency/thermal data and OEM bike pages; keep high-power claims media/prototype-bound until official closure."
