source_id,tier,source_type,evidence_form,title,publisher_or_owner,url,checked_date,verified_scope,key_verified_facts,limits_or_caveats
V018,O,official,text,"Pinion e-MTB selection page","Pinion","https://pinion.eu/en/e-bikes/e-mtb","2026-07-04","OEM e-MTB examples using Pinion E-Drive / MGU","Official Pinion page lists e-MTB examples including Simplon Rapcon :ePinion, Bulls Vuca EVO AM and FSX, Rotwild R.X1000, Nicolai Saturn 14 Swift and Tout Terrain Pamir, with E-Drive or Pinion references.","Official selection page proves category/OEM presence, but not independent sales volume or user satisfaction."
V019,O,official,text,"Pinion e-trekking selection page","Pinion","https://pinion.eu/en/e-bikes/e-trekking","2026-07-04","OEM trekking/SUV examples using Pinion E-Drive / MGU","Official Pinion page lists e-trekking/urban examples including Flyer Upstreet TR:CF, Kettler Pinniato, Kettler Quadriga, Rotwild R.C1000, Tout Terrain Pamir and VSF Fahrradmanufaktur T-X1000, with E-Drive or Pinion references.","Official selection page proves category/OEM presence, but not sales volume or owner feedback."
V020,O,official,text,"Simplon KAGU :ePinion High official product page","Simplon","https://www.simplon.com/en/Bikes/Trekking-Bikes/KAGU-ePinion-High_b_915075","2026-07-04","Simplon KAGU :ePinion High OEM bike example","Official Simplon page describes KAGU :ePinion High as a high-end SUV e-bike for urban commuting, off-road adventures and family outings. It highlights Pinion E1.12 MGU, 12-speed integrated transmission, Gates Carbon Drive belt, FIT system, 960 Wh battery and 150 kg maximum system weight.","Official product page; price and market performance not extracted in this pass."
V021,O,official,text,"Simplon Rapcon :ePinion official product page","Simplon","https://www.simplon.com/en/Bikes/E-Mountain-Bikes/Rapcon-ePinion_b_929057","2026-07-04","Simplon Rapcon :ePinion OEM eMTB example","Official Simplon page states Rapcon :ePinion uses Pinion MGU E1.12, Gates Carbon Drive belt, 12-speed integrated transmission, FIT system, 960 Wh battery, Bosch ABS Pro and Fox suspension. It positions the bike for eMTB uphill and downhill use.","Official product page; no independent ride assessment."
V022,B,media,text,"ElektroRad/Radfahren test of Simplon Kagu :ePinion High","Radfahren.de / ElektroRad","https://www.radfahren.de/test-technik/simplon-kagu-epinion-high-test/","2026-07-04","Professional test of Simplon Kagu :ePinion High with Pinion MGU","Review describes Kagu :ePinion High as a flagship SUV/touring e-bike with Pinion MGU, 960 Wh battery and Gates belt. It reports smooth/rund shifting, strong motor support, low maintenance and very high range. It notes gear shifts can be audibly heard in high gears and says automatic mode changed gears during climbs and descents so the tester barely missed derailleur gears.","Media test, not lab measurement. Subjective impressions from one review."
V023,B,media,text,"WELT bike test: Simplon Kagu ePinion with Pinion MGU","WELT","https://www.welt.de/motor/news/article252201374/Neues-E-Bike-System-im-Test-Pinion-MGU-am-Simplon-Kagu-ePinion.html","2026-07-04","Media ride test of Pinion MGU on Simplon Kagu ePinion","Search result and accessible snippet indicate the article tests Pinion MGU on Simplon Kagu ePinion and frames the system as motor and gearbox combined in one housing, with automatic shifting that can make gear changing unnecessary.","Snippet/search-result evidence only; article content not fully extracted. Use cautiously as media lead, not detailed finding."
V024,B,media,text,"WELT report on Flyer Upstreet TR:CF Pinion","WELT","https://www.welt.de/motor/news/article254225108/Flyer-Upstreet-TR-CF-7-63-Erstes-Fahrzeug-mit-neuem-Pinion-E-Bike-Antrieb.html","2026-07-04","Media/vehicle evidence for Flyer Upstreet TR:CF with Pinion MGU","Search result indicates Flyer Upstreet TR:CF 7.63 is presented as a vehicle with the new Pinion e-bike drive, combining motor and gearbox in one housing and described as innovative for sport/touring use.","Snippet/search-result evidence only; article content not fully extracted. Use as lead for OEM example, not full spec."
V025,O,official,text,"Simplon e-bike motors compared magazine page","Simplon","https://www.simplon.com/en/About-us/Magazine/E-Bike-Motors-Compared_bba_1152809","2026-07-04","Simplon's positioning of Pinion MGU versus Bosch/Avinox systems","Official Simplon page compares e-bike motors and states Pinion MGU offers maintenance-free shifting, integrated motor+transmission, 85 Nm torque, up to 12 gears, 600% range, 600/800 W peak power, Start.Select/Pre.Select and Auto.Shift for smooth gear changes.","Brand educational page, not independent testing. Useful for OEM messaging and positioning."
