architecture_id,architecture,representative_products_or_sources,mechanism,efficiency_view,ratio_range_view,ratio_speed_response,load_ratio_change,standstill_ratio_change,weight_volume,nvh,cost_complexity,failure_modes,e_bike_mgu_fit,implications_for_rider_feel_logic
ARCH001,"belt/pulley CVT","DAF/Variomatic; scooter CVT; generic belt CVT references","可变有效半径带轮 + V belt/chain，通过夹紧力和带轮位置改变传动比。","中等；取决于夹紧力、滑移、带弯曲损失和润滑/污染状态；高扭矩低速区热风险上升。","通常可做到约 3-6:1 量级，取决于带轮尺寸和包装空间。","伺服带轮可连续调，但高负载时速度受夹紧力和防滑策略限制。","中等；负载变比需要足够夹紧力，重载时容易把效率和热推坏。","弱到中等；通常希望有相对运动来完成带定位，静止变比能力取决于机构细节。","径向空间大，中置 MGU 包装不友好，泥水密封和散热难。","可较平顺，但可能有带啸叫、滑移声和夹紧执行器噪声。","中等；机械成本可控，但高可靠电控夹紧和密封会增加复杂度。","皮带磨损、打滑、锥面磨损、夹紧执行器失效、热衰退、污染导致寿命下降。","可做但不是高端 e-bike MGU 优先路线；更像踏板车/低成本自动变速路线。","巡航恒踏频可实现；冲刺和爬坡脚感取决于夹紧力、变比速度和热余量；曲柄低谷变比没有天然优势。"
ARCH002,"traction-ball CVT / CVP","NuVinci / enviolo AUTOMATiQ / CVP","倾斜球或滚动接触元件改变输入/输出接触半径，通过牵引油膜传递扭矩。","中低到中等；公开资料通常提示 CVP 效率低于高质量齿轮/链条路线，极端变比和高负载更差。","成熟自行车产品常见 310-400% 量级。","连续且平顺；执行器速度公开数据不足。","强；成熟 CVP 路线的优势是可在负载下连续变比。","强；比传统外变更适合停车或低速预置。","轮毂级重量和体积可接受于 city/utility，但中置高功率 MGU 的扭矩密度和散热仍要重做。","平顺安静是优势，但高负载接触区热和油膜状态可能影响 NVH。","中高；精密接触件、牵引油、预紧和控制执行器要求高。","牵引油膜失效、接触疲劳、预紧机构磨损、效率发热、密封和油液老化。","城市/trekking/cargo 的目标踏频 UX 成熟；高功率 eMTB MGU 需重新证明效率、热和重量。","巡航恒踏频支持最强；爬坡脚感可通过连续变比支持，但能否在陡坡高扭矩下长期成立取决于效率热；曲柄低谷窗口不是刚需但可用于减少执行扰动。"
ARCH003,"hydrostatic CVT","Honda HFT; hydrostatic CVT; Fendt Vario as hydro-mechanical analogy","变量泵/马达排量改变流量和压力关系，或通过机械+液压功率分流实现无级变速。","低；泵马达泄漏、节流、液压热损大，公开资料通常不适合自行车能量预算。","很宽，可包含零速/倒车。","很快，阀控/排量控制响应好。","很强；工程机械低速大扭矩优势明显。","很强；可实现零速和倒车逻辑。","泵、马达、油液、冷却和密封导致重量体积过高。","液压泵噪、脉动和油温相关 NVH 风险。","高；液压系统、密封、维护和污染管理复杂。","泄漏、油温过高、污染磨损、密封老化、阀/泵失效。","常规 e-bike 不建议，除非特殊低速工业/货运平台。","控制体验可借鉴 Drive/Sport/Manual 虚拟模式和起步/倒车，但硬件路线基本不适合主流 e-CVT MGU。"
ARCH004,"power-split eCVT","Toyota HSD; GM Voltec; HEV power-split literature","行星排/差动机构提供机械自由度，电机控制一个节点速度/扭矩，形成等效无级变速和功率分流。","中高到中低；机械直通比例高时好，电功率循环比例高时损失和热增加。","电子连续，范围取决于行星比、电机转速/扭矩和模式边界。","快；电机可快速调速调矩，但受电机/逆变器/电池功率和热限制。","强；扭矩协调可维持轮端连续性。","强；可通过电机控制和模式状态预置。","汽车成熟但缩小到 e-bike 后重量、成本、热、控制和安全边界很重。","无换挡冲击潜力好，但电机高频调节和齿隙/轴承会带来新 NVH。","高；行星排、电机、逆变器、控制软件和安全策略复杂。","电机/逆变器故障、行星齿轮轴承、控制失配、电功率循环发热、失效模式复杂。","技术可行但商业/包装风险高；更适合做原理借鉴而不是直接照搬汽车。","最适合借鉴“受控自由度、模式切换、扭矩协调和 jerk 管理”；冲刺电机先响应、齿比后跟随在控制上最自然，但能量和热窗口必须验证。"
ARCH005,"two-motor planetary eCVT","E2Drives/Owuru architecture signals; Toyota/GM analogy; potential Avinox/Gobao interpretations","两个电机与行星/差动/棘轮/皮带等机构组合，一个或多个电机参与助力、调速、发电或变比。","中等；机械路径效率、循环电功率、皮带/棘轮损耗和电机效率共同决定。","可宽，可连续或用虚拟档表示；E2Drives Gen1 公开 265%，高功率原型/媒体报道到 500% 量级但需复核。","理论上快；电机调速很快，机械执行/棘轮接合/热和控制稳定性是边界。","强；若电机有足够扭矩余量，可在负载下补扭并变比。","强；可通过电机和棘轮/自由轮状态处理停车、起步和滑行恢复。","潜力高但开发门槛高；双电机、行星/皮带/棘轮、控制器和散热都要集成。","平顺潜力好，但齿隙、自由轮回接、电机噪声和高频控制会影响高级体感。","很高；电机、电控、机械机构、软件和故障降级高度耦合。","双电机热管理、棘轮/自由轮磨损、传感器/控制失配、失电锁止或固定比策略不清。","最接近用户想做的“电机集成 e-CVT MGU”路线，但必须通过台架验证效率、热、变比速率和故障降级。","四类体感逻辑都有实现潜力；最关键 Go/No-Go 是 ratio lag 是否能被电机补扭覆盖、爬坡热降额后是否还能维持脚感力矩。"
ARCH006,"series / virtual-chain","Virtual-bike emulation papers; Schaeffler Free Drive concept","脚踏端发电，轮端电机驱动，机械链路由电控虚拟化。","中低；发电-逆变-电机多次能量转换损失明显。","理论上无限，软件定义传动比和踏感。","极快；软件可直接改变虚拟负载和轮端扭矩。","强；没有传统机械变比约束。","强；停车、倒车、滑行恢复可由电控定义。","布局灵活但需要发电机、驱动电机、电池和冗余安全策略。","踏感可塑性强，但如果控制差会明显“假”和断裂。","中高；机械少但电控、法规和安全冗余复杂。","电子故障即失去机械传动、热、法规归类、用户信任、低电可骑性。","适合概念车/特殊货运/封闭场景，不适合作为主流高效率 MGU 默认路线。","最容易软件实现脚感曲线，但效率和法规信任代价大；可作为控制算法和人机目标函数参考。"
ARCH007,"stepped gearbox + auto shift","Pinion MGU; Rohloff E-14; Bosch eShift partner systems","有级齿轮箱或外部/内部有级传动，通过电子执行器和电机降扭/同步实现自动换挡。","高；齿轮和链条路径通常优于 CVT 类，但换挡瞬间要处理扭矩中断。","高；Pinion MGU 公开 568/600% 量级。","中快；受离散档位、同步、犬牙/棘爪接合和降扭窗口限制。","强；量产系统已宣称/实现负载换挡或协同降扭。","强；Start.Select、auto-downshift、coasting preselect 等已是成熟功能。","中等；Pinion MGU 约 4 kg 量级，包装和维护已较成熟。","齿轮啮合声和换挡感可控，但不是完全无级。","高但可量产；机械和服务体系成熟度优于新型 eCVT。","犬牙/拨叉/棘爪磨损、油封、执行器、位置传感器、误换挡冲击。","近期最稳妥的量产 MGU 参考；不是 e-CVT，但替代压力强。","巡航恒踏频和起步/滑行逻辑强；冲刺和爬坡可做策略优化，但无法提供真正连续微调，曲柄相位窗口对它尤其重要。"
