comparison_id,brand,system,evidence_grade,current_status,architecture_class,transmission_form,gears_or_ratio,torque_power,weight,maintenance_or_service,oem_or_market_evidence,key_strength,key_uncertainty,source_ids
L1C001,Pinion,"E-Drive MGU E1.9","official_verified","production / OEM available","true MGU","9-speed gearbox","568% range","85 Nm competitive torque; 600/800 W peak power","about 4000 g","10,000 km oil-change interval claimed","OEM bikes exist; exact list not fully mapped in v3","Only fully verified production MGU benchmark with clear hard facts table.","User reliability, noise, cost, OEM volume and service experience still need third-party evidence.","V001"
L1C002,Pinion,"E-Drive MGU E1.12","official_verified","production / OEM available","true MGU","12-speed gearbox","600% range","85 Nm competitive torque; 600/800 W peak power","about 4100 g","10,000 km oil-change interval claimed","OEM bikes exist; exact list not fully mapped in v3","Best current production reference for wide-ratio integrated motor+gearbox.","User reliability, noise, cost, OEM volume and service experience still need third-party evidence.","V001"
L1C003,Gobao,"X-system Urban & Trekking","official_verified","official product page / production timing not independently verified","true MGU","automatic continuously variable transmission","400% max gear range","120 Nm; 1200 W",3.85 kg,"not verified","official page product block; direct X1 naming not verified","Strong China MGU/eCVT threat; weight and output look aggressive versus Pinion.","Need confirm commercial readiness, OEM adoption, X1 mapping, thermal/efficiency/lifespan and charge table.","V004"
L1C004,Gobao,"X-system MTB & Cargo","official_verified","official product page / production timing not independently verified","true MGU","automatic continuously variable transmission","500% max gear range","150 Nm; 1500 W",3.85 kg,"not verified","official page product block; direct X1P naming not verified","Closest verified spec to a high-output eCVT MGU competitor.","Need confirm commercial readiness, OEM adoption, X1P mapping, thermal/efficiency/lifespan and charge table.","V004"
L1C005,"DJI / Avinox","MG Concept","media_verified_official_gap","concept / prototype signal","true MGU reported by media","reported eCVT / automatic gearing","not verified","not verified","not verified","not verified","The Verge reports prototype bikes from Canyon, Commencal, Forbidden and Mondraker","Most important strategic reference because of DJI/Avinox integration capability and brand momentum.","No official spec found; cannot transfer M2S/M2/M1 values; product timing and architecture details remain unverified.","V003;V017"
L1C006,Valeo,"Cyclee / Smart e-Bike System","media_historical_lead","historical / current status unknown","reported true MGU","reported integrated automatic adaptive gearbox","7-speed reported by media","130 Nm reported by media","not verified","not verified","no current OEM status verified","Important historical proof that motor+automatic gearbox concept predates current MGU wave.","Media-only; official/current status unresolved; do not compare as active product until verified.","V015"
L1C007,Revonte,"Revonte ONE","lead_only","historical / current status unknown","reported integrated motor+CVT lead","CVT reported by search/media lead","not verified","not verified","not verified","not verified","no current OEM status verified","Potential cautionary case for integrated CVT drive commercial difficulty.","Content not verified; no specs should be used.","V016"
L1C008,Owuru,"automatic/stepless transmission","unresolved","unknown","unknown","unknown","not verified","not verified","not verified","not verified","not verified","Could still matter if it proves automatic stepless e-bike transmission traction.","No usable source found; remove from active L1 comparison until verified.",""
