scenario,pain_intensity,mgu_incremental_value,against_electronic_derailleur,against_hub_gear_or_cvt,against_ordinary_mid_drive,why_oem_would_choose_mgu,why_oem_might_not,preliminary_rank,evidence_ids
"Premium SUV / trekking","high","high","MGU reduces exposed drivetrain maintenance more than electronic derailleur systems, while still offering automatic/semi-automatic shift potential.","MGU centralizes mass and keeps rear wheel simpler than hub gear/CVT alternatives, with stronger integrated diagnostics potential.","Ordinary mid-drive lacks low-maintenance transmission differentiation.","OEM can sell low-maintenance, belt-friendly, wide-range, premium integrated experience with strong user-visible value.","Cost, weight, supplier lock-in and service training remain risks.","top candidate","V001;V020;V022;F001;F004;F020;F022"
"Cargo / family utility","very high","high","Electronic derailleur still leaves chain/cassette/derailleur exposed under high load and frequent stop-start use.","Hub gear/CVT solves much of the low-maintenance need, but puts complexity and mass in rear wheel; torque/load limits must be checked.","Ordinary mid-drive still depends on external transmission durability.","OEM can position MGU around loaded starts, low maintenance, centralized mass and family/commercial reliability.","Need high-load lifespan proof, service strategy and total vehicle cost control.","top candidate if durability proven","V001;V009;V010;V011;F020;F021;F022;F023"
"High-end touring / adventure","high","medium-high","Electronic derailleur is serviceable but exposed; long-distance riders may value sealed systems more.","Rohloff/Pinion gearbox already strong substitutes; MGU must add motor-shift integration and centralization.","Ordinary mid-drive lacks drivetrain durability story.","OEM can sell long-range, low-maintenance, sealed drivetrain and wide-ratio reliability.","Market size and willingness to accept MGU weight/cost need validation.","strong niche","V001;V011;V014;F004;F023;F025"
"High-end eMTB","medium-high","medium","Electronic derailleur systems are light, familiar and sport-accepted; SRAM/Shimano already solve some shift-control pain.","Hub gear/CVT less common for aggressive eMTB due rear mass/feel concerns; MGU centralizes mass and removes rear derailleur.","Ordinary high-performance mid-drives are strong and lighter; MGU must add real climbing/impact/maintenance advantage.","OEM can create flagship differentiation, simplify rear end and show technical leadership.","Weight, NVH, manual control, impact durability and rider trust are high barriers.","strategic validation, not safest first market","V001;V008;V018;V021;F016;F018"
"Urban commuter","medium","medium-low","Electronic shifting/ordinary drivetrains may be enough for many users; cost sensitivity is higher.","enviolo Automatic and similar hubs already solve automatic low-maintenance commuting well.","Ordinary mid-drives or hub motors may be cheaper and sufficient.","OEM can use MGU for premium commuter differentiation and low-maintenance belt builds.","MGU cost may exceed user willingness to pay; substitutes are mature.","selective premium only","V005;V007;V009;F013;F016;F020"
"Lightweight eMTB / eGravel","low-medium","low","Electronic derailleur is lighter and accepted; user maintenance tolerance is higher.","Hub systems are also weight/feel challenged in this segment.","Lightweight mid-drives like TQ/FAZUA-style benchmarks likely better match segment expectations, though not verified in current evidence.","OEM may choose MGU only for niche concept differentiation.","Weight and integration complexity likely overpower pain-point benefits.","not recommended early","F015"
